results/wider_head/val_loss.csv

epoch,val_loss_total,bce,mse,10%_win_acc,5%_win_acc,2%_win_acc,1%_win_acc,0.5%_win_acc
1,0.00104026216414719,0.001143618089887482,0.0001100588324845602,0.6458691911525037,0.5794606999939226,0.5488382100340832,0.4720309811184205,0.18488238674091048
2,0.0007265939892519041,0.0008003217458956871,6.304417945785648e-05,0.8312535860452307,0.7644865177721384,0.7188037868484436,0.6575588069287649,0.37679288593162014
3,0.0007493789250617398,0.0008251784616206065,6.718309603193887e-05,0.7910929434749496,0.7262621916920305,0.6770654045434362,0.6303786575554844,0.36976477348182096
4,0.0007484709359228858,0.0008245547120665092,6.371695063027588e-05,0.8070854848647213,0.7378083764309864,0.6935599542047125,0.6343230064135479,0.30600975340149966
5,0.0011465770074071215,0.0012612271136192821,0.00011472605149767522,0.6851692486958332,0.6197647734818209,0.5806081469757969,0.5293316122997238,0.2763195641069527
6,0.00069810323037522,0.0007684033756316396,6.540192306744417e-05,0.8397877225914154,0.7785427426717367,0.7242541595635165,0.6755593804470507,0.45109007468664025
7,0.0008300785014515454,0.0009138111747898551,7.648444140675813e-05,0.7182300631779743,0.6554790591619101,0.615318416591629,0.551491681112343,0.3189902468378764
8,0.0006957992463728614,0.0007662366564669852,6.186255552574766e-05,0.8604417670682731,0.8002008032128514,0.7513625932984562,0.6925559381404555,0.40942340801997357
9,0.0006405068200697736,0.0007058574746074866,5.235092923035574e-05,0.8709122205833834,0.8141135973145205,0.7728772232810177,0.712636259425596,0.4360298337227848

README.md

## best so far : using bilinear upsampling

(guidewire_detector) jaehun@jh22:~/workspace/guidewire_tip_detector_pytorch$ python3 -m engine.test_unfreeze --train --config wider_head.yaml
Start training...
config loaded. number of keys: 6
Loading weights from /home/jaehun/workspace/guidewire_tip_detector_pytorch/weights/yolo_v11_s.pt
Total parameters: 10,051,266
Trainable parameters: 10,051,266
Epoch 1/30 - val_loss_total: 0.001040, val_acc5: 0.57946, val_acc1: 0.47203                                             
Epoch 2/30 - val_loss_total: 0.000727, val_acc5: 0.76449, val_acc1: 0.65756                                             
Epoch 3/30 - val_loss_total: 0.000749, val_acc5: 0.72626, val_acc1: 0.63038                                             
Epoch 4/30 - val_loss_total: 0.000748, val_acc5: 0.73781, val_acc1: 0.63432                                             
Backbone unfreezed at epoch 5
Epoch 5/30 - val_loss_total: 0.001147, val_acc5: 0.61976, val_acc1: 0.52933                                             
Epoch 6/30 - val_loss_total: 0.000698, val_acc5: 0.77854, val_acc1: 0.67556                                             
Epoch 7/30 - val_loss_total: 0.000830, val_acc5: 0.65548, val_acc1: 0.55149                                             
Epoch 8/30 - val_loss_total: 0.000696, val_acc5: 0.80020, val_acc1: 0.69256                                             
Epoch 9/30 - val_loss_total: 0.000641, val_acc5: 0.81411, val_acc1: 0.71264